<?xml version="1.0"?>
<!DOCTYPE storm SYSTEM "../storm.dtd">
<storm>
	<rules>

		<rule name="kovarskaSoutez_ucednikMatej">
			<selectors>
				<hasName name="kgru_matej" />
			</selectors>
			<operations>
				<addRole name="MATEJ" />
			</operations>
		</rule>
		
		<rule name="kovarskaSoutez_kovarZdimir">
			<selectors>
				<hasName name="kgru_zdimir" />
			</selectors>
			<operations>
				<addRole name="ZDIMIR" />
			</operations>
		</rule>
		
		<rule name="kovarskaSoutez_kovarZdimirWatcher">
			<selectors>
				<hasName name="kgru_zdimir" />
			</selectors>
			<operations>
				<addRole name="ZDIMIR_SOUBOJOVE_BARKY" />
			</operations>
		</rule>

		<rule name="kovarskaSoutez_tipster_muz">
			<selectors>
				<hasName name="kgru_gros" />
			</selectors>
			<operations>
				<addRole name="QUEST_TIPSTER_KOVOSOUTEZ_MUZ" />
			</operations>
		</rule>

		<rule name="kovarskaSoutez_tipster_zena">
			<selectors>
				<hasName name="ksta_innkeeper" />
			</selectors>
			<operations>
				<addRole name="QUEST_TIPSTER_KOVOSOUTEZ_NEMKA" />
			</operations>
		</rule>
		
    </rules>
</storm>