<?xml version="1.0"?>
<!DOCTYPE storm SYSTEM "../storm.dtd">
<storm>
	<rules>
		<rule name="setkaniVRatbori2_ratborDrunk">
			<selectors>
				<and>
					<hasName name="setkaniVRatbori1_ratiborNoble*" />
					<isMan />
				</and>
			</selectors>
			<operations>
				<addRole name="RATBOR_OPILE_GREETINGY" />
			</operations>
		</rule>

		<rule name="setkaniVRatbori2_ratborReactionToSingingMen">
			<selectors>
				<and>
					<hasName name="setkaniVRatbori1_ratibor*" />
					<isMan />
				</and>
			</selectors>
			<operations>
				<addRole name="RATBOR_REAKCE_NA_ZPEV_MUZ" />
			</operations>
		</rule>

		<rule name="setkaniVRatbori2_ratborReactionToSingingWomen">
			<selectors>
				<and>
					<hasName name="setkaniVRatbori1_ratibor*" />
					<isWoman />
				</and>
			</selectors>
			<operations>
				<addRole name="RATBOR_REAKCE_NA_ZPEV_ZENA" />
			</operations>
		</rule>

		<rule name="setkaniVRatbori2_annaZValdstejna">
			<selectors>
				<hasName name="kkut_annaZValdstejna" />
			</selectors>
			<operations>
				<addRole name="ANNA_Z_VALDSTEJNA" />
			</operations>
		</rule>

		<rule name="setkaniVRatbori2_helena">
			<selectors>
				<hasName name="setkaniVRatbori1_ratiborNobleWoman1" />
			</selectors>
			<operations>
				<addRole name="HELENA_Z_DVORCE" />
			</operations>
		</rule>

		<rule name="setkaniVRatbori2_kristyna">
			<selectors>
				<hasName name="setkaniVRatbori1_ratiborNobleWoman2" />
			</selectors>
			<operations>
				<addRole name="KRISTYNA_Z_NOSTIC" />
			</operations>
		</rule>

		<rule name="setkaniVRatbori2_matylda">
			<selectors>
				<hasName name="setkaniVRatbori1_ratiborNobleWoman3" />
			</selectors>
			<operations>
				<addRole name="MATYLDA_ZE_SLAVIC" />
			</operations>
		</rule>

		<rule name="setkaniVRatbori2_femaleCowards">
			<selectors>
				<and>
					<hasName name="setkaniVRatbori1_*" />
					<isWoman />
				</and>
			</selectors>
			<operations>
				<addRole name="KRCICI_SE_ZENA" />
			</operations>
		</rule>

		<rule name="setkaniVRatbori2_pacholek">
			<selectors>
				<hasName name="setkaniVRatbori1_ratiborHorsetrader2" />
			</selectors>
			<operations>
				<addRole name="PACHOLEK_RATBOR_POSILY" />
				<addRole name="STOLBA_RATBOR" />
			</operations>
		</rule>

		<rule name="setkaniVRatbori2_MaidsWineHint">
			<selectors>
				<hasName name="setkaniVRatbori1_ratiborMaid*" />
			</selectors>
			<operations>
				<addRole name="SLUZEBNA_RATBOR" />
			</operations>
		</rule>

		<rule name="setkaniVRatbori2_pissedMaid">
			<selectors>
				<hasName name="setkaniVRatbori1_ratiborMaid2" />
			</selectors>
			<operations>
				<addRole name="SLUZKA_SE_SMETAKEM" />
				<addRole name="SLUZEBNA_ELISKA_RATBOR" />
				<addRole name="DEVECKA_RATBOR_2" />
			</operations>
		</rule>

		<rule name="setkaniVRatbori2_prayingMaid">
			<selectors>
				<hasName name="setkaniVRatbori1_ratiborMaid1" />
			</selectors>
			<operations>
				<addRole name="DEVECKA_RATBOR_1" />
				<addRole name="KUCHARKA_MADLA_RATBOR" />
			</operations>
		</rule>

		<rule name="setkaniVRatbori2_maid5">
			<selectors>
				<hasName name="setkaniVRatbori1_ratiborMaid5" />
			</selectors>
			<operations>
				<addRole name="SLUZEBNA_DASA_RATBOR" />
			</operations>
		</rule>

		<rule name="setkaniVRatbori2_intimateMaid">
			<selectors>
				<hasName name="setkaniVRatbori1_ratiborMaid4" />
			</selectors>
			<operations>
				<addRole name="SLUZKA_U_PREVETU" />
			</operations>
		</rule>

		<rule name="setkaniVRatbori2_intimateGuard">
			<selectors>
				<hasName name="setkaniVRatbori1_ratiborGuard5" />
			</selectors>
			<operations>
				<addRole name="UZIVAJICI_SI_STRAZNY" />
			</operations>
		</rule>
		
		<rule name="setkaniVRatbori2_flirtatingGuard">
			<selectors>
				<hasName name="setkaniVRatbori1_ratiborGuard16" />
			</selectors>
			<operations>
				<addRole name="VOJAK_RATBOR" />
			</operations>
		</rule>

		<rule name="setkaniVRatbori2_tableDlgGuard1">
			<selectors>
				<hasName name="setkaniVRatbori1_ratiborGuard1" />
			</selectors>
			<operations>
				<addRole name="STRAZ_U_STOLU_1" />
			</operations>
		</rule>

		<rule name="setkaniVRatbori2_barrelDlgNoble6">
			<selectors>
				<hasName name="setkaniVRatbori1_ratiborNoble6" />
			</selectors>
			<operations>
				<addRole name="SLECHTIC_U_SOUDKU_1" />
			</operations>
		</rule>

		<rule name="setkaniVRatbori2_barrelDlgNoble7">
			<selectors>
				<hasName name="setkaniVRatbori1_ratiborNoble7" />
			</selectors>
			<operations>
				<addRole name="SLECHTIC_U_SOUDKU_2" />
				<addRole name="OPILY_SLECHTIC_V_SINI_1" />
			</operations>
		</rule>

		<rule name="setkaniVRatbori2_tableDlgNoble8">
			<selectors>
				<hasName name="setkaniVRatbori1_ratiborNoble8" />
			</selectors>
			<operations>
				<addRole name="SLECHTIC_U_STOLU_V_KUCHYNI_1" />
				<addRole name="OPILY_SLECHTIC_V_SINI_2" />
			</operations>
		</rule>

		<rule name="setkaniVRatbori2_tableDlgNoble9">
			<selectors>
				<hasName name="setkaniVRatbori1_ratiborNoble9" />
			</selectors>
			<operations>
				<addRole name="SLECHTIC_U_STOLU_V_KUCHYNI_2" />
				<addRole name="OPILY_SLECHTIC_S_VINI_3" />
			</operations>
		</rule>

		<rule name="setkaniVRatbori2_tableDlgNoble10">
			<selectors>
				<hasName name="setkaniVRatbori1_ratiborNoble10" />
			</selectors>
			<operations>
				<addRole name="SLECHTIC_U_STOLU_V_KUCHYNI_3" />
			</operations>
		</rule>

		<rule name="setkaniVRatbori2_mainHallDlgGuard3">
			<selectors>
				<hasName name="setkaniVRatbori1_ratiborGuard3" />
			</selectors>
			<operations>
				<addRole name="OPILY_STRAZNY_1" />
			</operations>
		</rule>

		<rule name="setkaniVRatbori2_mainHallDlgGuard4">
			<selectors>
				<hasName name="setkaniVRatbori1_ratiborGuard4" />
			</selectors>
			<operations>
				<addRole name="OPILY_STRAZNY_2" />
			</operations>
		</rule>

		<rule name="setkaniVRatbori2_deadHorseDlgNoble11">
			<selectors>
				<hasName name="setkaniVRatbori1_ratiborNoble11" />
			</selectors>
			<operations>
				<addRole name="SLECHTIC_U_KONE_1" />
			</operations>
		</rule>

		<rule name="setkaniVRatbori2_drunkDlgNoble16">
			<selectors>
				<hasName name="setkaniVRatbori1_ratiborNoble16" />
			</selectors>
			<operations>
				<addRole name="OPILY_SLECHTIC_1" />
				<addRole name="SLECHTIC_U_KONE_2" />
			</operations>
		</rule>

		<rule name="setkaniVRatbori2_drunkDlgNoble17">
			<selectors>
				<hasName name="setkaniVRatbori1_ratiborNoble17" />
			</selectors>
			<operations>
				<addRole name="OPILY_SLECHTIC_2" />
				<addRole name="SLECHTIC_U_KONE_3" />
			</operations>
		</rule>

		<rule name="setkaniVRatbori2_tableDlgNoble1">
			<selectors>
				<hasName name="setkaniVRatbori1_ratiborNoble12" />
			</selectors>
			<operations>
				<addRole name="SLECHTIC_U_STOLU_1" />
				<addRole name="SLECHTIC_NA_LAVICI_V_SINI_1" />
			</operations>
		</rule>

		<rule name="setkaniVRatbori2_tableDlgNoble2">
			<selectors>
				<hasName name="setkaniVRatbori1_ratiborNoble13" />
			</selectors>
			<operations>
				<addRole name="SLECHTIC_U_STOLU_2" />
				<addRole name="SLECHTIC_NA_LAVICI_V_SINI_2" />
			</operations>
		</rule>

		<rule name="setkaniVRatbori2_beerDrinker1">
			<selectors>
				<hasName name="setkaniVRatbori1_ratiborNoble2" />
			</selectors>
			<operations>
				<addRole name="PIVAR_1" />
			</operations>
		</rule>

		<rule name="setkaniVRatbori2_beerDrinker2">
			<selectors>
				<hasName name="setkaniVRatbori1_ratiborNoble3" />
			</selectors>
			<operations>
				<addRole name="PIVAR_2" />
			</operations>
		</rule>

		<rule name="setkaniVRatbori2_tableDlgGuard2">
			<selectors>
				<hasName name="setkaniVRatbori1_ratiborGuard2" />
			</selectors>
			<operations>
				<addRole name="STRAZ_U_STOLU_2" />
			</operations>
		</rule>

		<rule name="setkaniVRatbori2_BohutaPray">
			<selectors>
				<hasName name="tneb_bohuta" />
			</selectors>
			<operations>
				<addRole name="BOHUTA_NPC_MODLI_SE" />
			</operations>
		</rule>

		<rule name="setkaniVRatbori2_zizkaYellAtBohuta">
			<selectors>
				<hasName name="tneb_zizka" />
			</selectors>
			<operations>
				<addRole name="ZIZKA_VOLA_V_BOJI_NA_BOHUTU" />
				<addRole name="ZIZKA_DOSTAL_ZASAH_RATBOR" />
				<addRole name="ZIZKA_ZASAHL_NEPRITELE_RATBOR" />
			</operations>
		</rule>

		<rule name="setkaniVRatbori2_haggleWithEliska">
 			<selectors>
    			<hasName name="setkaniVRatbori1_ratiborMaid2"/>
  			</selectors>
			<operations>
    			<addRole name="VYJEDNAVANI_ZENA"/>
  			</operations>
		</rule>

		<rule name="setkaniVRatbori2_enemyCommander">
 			<selectors>
    			<hasName name="setkaniVRatbori2_court_enemy_soldier_1"/>
  			</selectors>
			<operations>
    			<addRole name="RATBOR_VELITEL_UTOCNIKU"/>
  			</operations>
		</rule>
    </rules>
</storm>