<?xml version="1.0"?>
<!DOCTYPE storm SYSTEM "..\storm.dtd">
<storm>
  <rules>

    <rule name="inventory_tkop_man_1" Mode="and">
      <selectors>
        <hasName name="tkop_man_1" />
      </selectors>
      <operations>
        <setInventory preset="inventory_tkop_man_1" />
      </operations>
    </rule>

    <rule name="inventory_tkop_man_2" Mode="and">
      <selectors>
        <hasName name="tkop_man_2" />
      </selectors>
      <operations>
        <setInventory preset="inventory_tkop_man_2" />
      </operations>
    </rule>

  </rules>
</storm>