<?xml version="1.0"?>
<!DOCTYPE storm SYSTEM "..\storm.dtd">
<storm>
	<rules>

		<rule name="inventory_erik_suchdol_gate_guard">
			<selectors>
				<hasName Name="erik_guard" />
			</selectors>
			<operations>
				<setInventory preset="inventory_erik_guard" />
			</operations>
		</rule>

		<rule name="inventory_erik_suchdol_party_soldier_barrel">
			<selectors>
				<hasName Name="erik_party_barrelMan_1" />
			</selectors>
			<operations>
				<setInventory preset="inventory_erik_party_soldier_barrel" />
			</operations>
		</rule>

		<rule name="inventory_erik_suchdol_party_soldier_dancer">
			<selectors>
				<hasName Name="erik_party_dancerMan_1" />
			</selectors>
			<operations>
				<setInventory preset="inventory_erik_party_soldier_dancer" />
			</operations>
		</rule>

		<rule name="inventory_erik_suchdol_party_soldier_sitting">
			<selectors>
				<hasName Name="erik_party_sittingGroupMan_2" />
			</selectors>
			<operations>
				<setInventory preset="inventory_erik_party_soldier_sitter" />
			</operations>
		</rule>

		<rule name="inventory_erik_suchdol_party_dancerWoman_1">
			<selectors>
				<hasName Name="erik_party_dancerWoman_1" />
			</selectors>
			<operations>
				<setInventory preset="inventory_erik_party_dancerWoman_1" />
			</operations>
		</rule>

		<rule name="inventory_erik_suchdol_party_dancerWoman_2">
			<selectors>
				<hasName Name="erik_party_dancerWoman_2" />
			</selectors>
			<operations>
				<setInventory preset="inventory_erik_party_dancerWoman_2" />
			</operations>
		</rule>

		<rule name="inventory_erik_suchdol_vozka">
			<selectors>
				<hasName Name="erik_vozka" />
			</selectors>
			<operations>
				<setInventory preset="inventory_erik_vozka" />
			</operations>
		</rule>

		<rule name="inventory_erik_suchdol_party_muscian_1">
			<selectors>
				<hasName Name="erik_party_musician_1" />
			</selectors>
			<operations>
				<setInventory preset="inventory_erik_party_musician_1" />
			</operations>
		</rule>

		<rule name="inventory_erik_suchdol_party_muscian_2">
			<selectors>
				<hasName Name="erik_party_musician_2" />
			</selectors>
			<operations>
				<setInventory preset="inventory_erik_party_musician_2" />
			</operations>
		</rule>

		<rule name="inventory_erik_party_groupMan_1">
			<selectors>
				<hasName Name="erik_party_groupMan_1" />
			</selectors>
			<operations>
				<setInventory preset="inventory_erik_party_groupMan_1" />
			</operations>
		</rule>

		<rule name="inventory_erik_party_groupMan_2">
			<selectors>
				<hasName Name="erik_party_groupMan_2" />
			</selectors>
			<operations>
				<setInventory preset="inventory_erik_party_groupMan_2" />
			</operations>
		</rule>

		<rule name="inventory_erik_party_sittingGroupMan_1">
			<selectors>
				<hasName Name="erik_party_sittingGroupMan_1" />
			</selectors>
			<operations>
				<setInventory preset="inventory_erik_party_sittingGroupMan_1" />
			</operations>
		</rule>

		<rule name="inventory_erik_party_groupWoman_1">
			<selectors>
				<hasName Name="erik_party_groupWoman_1" />
			</selectors>
			<operations>
				<setInventory preset="inventory_erik_party_groupWoman_1" />
			</operations>
		</rule>

		<rule name="inventory_erik_soldier">
			<selectors>
				<or>
					<hasName Name="erik_soldier1" />
					<hasName Name="erik_soldier2" />
					<hasName Name="erik_soldier3" />
				</or>
			</selectors>
			<operations>
				<setInventory preset="inventory_erik_soldier" />
			</operations>
		</rule>

		<rule name="inventory_erik_horse">
			<selectors>
				<or>
					<hasName Name="erik_soldier_horse1" />
					<hasName Name="erik_soldier_horse2" />
					<hasName Name="erik_soldier_horse3" />
					<hasName Name="erik_cavalryHorse*" />
				</or>
			</selectors>
			<operations>
				<setInventory preset="horse_prague" />
			</operations>
		</rule>

		<rule name="inventory_erik_animchar_heavy">
			<selectors>
				<or>
					<hasName Name="erik_cavalryGroup1_soldier*" />
					<hasName Name="erik_cavalryGroup2_soldier*" />
					<hasName Name="erik_cavalryGroup3_soldier*" />
					<hasName Name="erik_cavalryGroup4_soldier*" />
					<hasName Name="erik_cavalryGroup5_soldier*" />
					<hasName Name="erik_cavalryGroup6_soldier*" />
				</or>
			</selectors>
			<operations>
				<setInventory preset="inventory_erik_soldier_animchar_heavy" />
			</operations>
		</rule>

		<rule name="inventory_erik_animchar_light">
			<selectors>
				<or>
					<hasName Name="erik_cavalryGroup1_scout*" />
					<hasName Name="erik_infantryGroup1_soldier*" />
				</or>
			</selectors>
			<operations>
				<setInventory preset="inventory_erik_soldier_animchar_light" />
			</operations>
		</rule>



	</rules>
</storm>
