<?xml version="1.0"?>
<!DOCTYPE storm SYSTEM "..\storm.dtd">
<storm>
	<rules>

		<rule name="inventory_fistfightsHorany_beruska" Mode="and">
			<selectors>
				<hasName Name="kgru_man_53" />
			</selectors>
			<operations>
				<setInventory preset="inventory_fistfightsHorany_beruska" />
			</operations>
		</rule>

		<rule name="inventory_fistfightsHorany_tuma" Mode="and">
			<selectors>
				<hasName Name="khor_man_1" />
			</selectors>
			<operations>
				<setInventory preset="inventory_fistfightsHorany_tuma" />
			</operations>
		</rule>

		<rule name="inventory_fistfightsHorany_stanik" Mode="and">
			<selectors>
				<hasName Name="khor_man_24" />
			</selectors>
			<operations>
				<setInventory preset="inventory_fistfightsHorany_stanik" />
			</operations>
		</rule>

	</rules>
</storm>